{
  "schemaVersion": 1,
  "task": "llama",
  "version": "2026-07-10",
  "models": [
    {
      "id": "qwen3.6-35b-a3b",
      "display": {
        "name": "Qwen 3.6 35B A3B",
        "description": "Curated local Qwen model with vision configuration.",
        "labels": ["Text", "Vision", "Reasoning", "Tool use"],
        "license": "Apache-2.0",
        "documentationUrl": "https://huggingface.co/unsloth/Qwen3.6-35B-A3B-GGUF"
      },
      "source": {
        "repository": "unsloth/Qwen3.6-35B-A3B-GGUF",
        "revision": "main"
      },
      "defaults": {
        "catalogModelId": "qwen3.6-35b-a3b-local",
        "routerModelId": "Qwen3.6-35B-A3B-GGUF",
        "runtimeProfileId": "qwen3_6",
        "targetDirectory": "Qwen3.6-35B-A3B-GGUF",
        "mmproj": { "path": "mmproj-F16.gguf" },
        "routerPreset": {
          "ctx-size": "131072",
          "image-min-tokens": "1024"
        }
      },
      "quantMetadata": {
        "recommendedLabels": ["UD-Q4_K_XL", "UD-Q5_K_XL", "Q4_K_M"]
      }
    },
    {
      "id": "qwen3.6-35b-a3b-mtp",
      "display": {
        "name": "Qwen 3.6 35B A3B MTP",
        "description": "Curated local Qwen model with MTP configuration.",
        "labels": ["Text", "Vision", "Reasoning", "Tool use", "MTP"],
        "license": "Apache-2.0",
        "documentationUrl": "https://huggingface.co/unsloth/Qwen3.6-35B-A3B-MTP-GGUF"
      },
      "source": {
        "repository": "unsloth/Qwen3.6-35B-A3B-MTP-GGUF",
        "revision": "main"
      },
      "defaults": {
        "catalogModelId": "qwen3.6-35b-a3b-mtp-local",
        "routerModelId": "Qwen3.6-35B-A3B-MTP-GGUF",
        "runtimeProfileId": "qwen3_6",
        "targetDirectory": "Qwen3.6-35B-A3B-MTP-GGUF",
        "mmproj": { "path": "mmproj-F16.gguf" },
        "routerPreset": {
          "ctx-size": "131072",
          "image-min-tokens": "1024",
          "spec-type": "draft-mtp",
          "spec-draft-n-max": "2"
        }
      },
      "quantMetadata": {
        "recommendedLabels": ["UD-Q4_K_XL"]
      }
    }
  ]
}
